### DISCUSSION TITLE
为什么在关闭状态下nft规则还在

### DISCUSSION THREAD

**Discussion by ltxhhz** [v2rayA/v2rayA#1916] [Q&A] [answered]
<img width="1901" height="1398" alt="image" src="https://github.com/user-attachments/assets/3c436745-7ab7-4934-ab86-8c207a97e9b3" />

页面上的直通白名单也不能取消只能单选
dns请求也发不出去，只能手动删规则

**Comment by ltxhhz** [comment]
想加群问问，这个tg验证，也没这个选项，等我搜到宽字符已经过期被拉黑了。。
<img width="500"  alt="image" src="https://github.com/user-attachments/assets/de8d02b0-7167-49ca-9171-617be43111a9" />

**Comment by ltxhhz** [comment]
```shell
root@CM3588 [00时47分31秒] [~]
-> # uname -a
Linux CM3588 6.1.57 #11 SMP Fri Apr 26 12:02:53 CST 2024 aarch64 aarch64 aarch64 GNU/Linux
root@CM3588 [00时53分41秒] [~]
-> # cat /etc/os-release
PRETTY_NAME="Ubuntu 24.04.4 LTS"
NAME="Ubuntu"
VERSION_ID="24.04"
VERSION="24.04.4 LTS (Noble Numbat)"
VERSION_CODENAME=noble
ID=ubuntu
ID_LIKE=debian
HOME_URL="https://www.ubuntu.com/"
SUPPORT_URL="https://help.ubuntu.com/"
BUG_REPORT_URL="https://bugs.launchpad.net/ubuntu/"
PRIVACY_POLICY_URL="https://www.ubuntu.com/legal/terms-and-policies/privacy-policy"
UBUNTU_CODENAME=noble
LOGO=ubuntu-logo
```
<details>
<summary>命令输出</summary>

```shell
root@CM3588 [00时27分11秒] [/etc/v2raya]
-> # ll
总计 192
drwxr-xr-x 2 root root  4096  7月 24 00:06 bk
-rw------- 1 root root 32768  7月 24 00:08 boltv4.db
-rw------- 1 root root  7258  7月 24 00:26 config.json
-rw-r--r-- 1 root root 57344  7月 24 00:11 v2raya.db
-rw-r--r-- 1 root root 32768  7月 24 00:27 v2raya.db-shm
-rw-r--r-- 1 root root 57712  7月 24 00:27 v2raya.db-wal
-rw-r--r-- 1 root root  3197  7月 24 00:26 v2raya.nft
root@CM3588 [00时28分34秒] [/etc/v2raya]
-> # micro v2raya.nft
root@CM3588 [00时33分23秒] [/etc/v2raya]
-> # nft list table inet v2raya
Error: No such file or directory
list table inet v2raya
                ^^^^^^
root@CM3588 [00时33分25秒] [/etc/v2raya]
-> # nft list tables
table ip filter
table ip nat
table ip6 filter
table ip6 nat
table ip raw
root@CM3588 [00时33分40秒] [/etc/v2raya]
-> # iptables -t nat -S
-P PREROUTING ACCEPT
-P INPUT ACCEPT
-P OUTPUT ACCEPT
-P POSTROUTING ACCEPT
-N DOCKER
-A PREROUTING -p tcp -m tcp --dport 53 -j REDIRECT --to-ports 52353
-A PREROUTING -p udp -m udp --dport 53 -j REDIRECT --to-ports 52353
-A PREROUTING -m addrtype --dst-type LOCAL -j DOCKER
-A OUTPUT -p tcp -m tcp --dport 53 -j REDIRECT --to-ports 52353
-A OUTPUT -p udp -m udp --dport 53 -j REDIRECT --to-ports 52353
-A OUTPUT ! -d 127.0.0.0/8 -m addrtype --dst-type LOCAL -j DOCKER
-A POSTROUTING -s 172.17.0.0/16 ! -o docker0 -j MASQUERADE
-A POSTROUTING -s 172.27.0.0/16 ! -o br-03295b7c56e5 -j MASQUERADE
-A POSTROUTING -s 172.19.0.0/16 ! -o br-f9fb79b556fe -j MASQUERADE
-A POSTROUTING -s 172.25.0.0/16 ! -o br-dabddbedac96 -j MASQUERADE
-A POSTROUTING -s 172.20.0.0/16 ! -o br-d1b395c19330 -j MASQUERADE
-A POSTROUTING -s 172.23.0.0/16 ! -o br-ccf8ad7e4352 -j MASQUERADE
-A POSTROUTING -s 172.26.0.0/16 ! -o br-c8a4b7f1f49e -j MASQUERADE
-A POSTROUTING -s 172.22.0.0/16 ! -o br-68cb70ff7627 -j MASQUERADE
-A POSTROUTING -s 172.21.0.0/16 ! -o br-35578642c035 -j MASQUERADE
-A POSTROUTING -s 172.18.0.0/16 ! -o br-16404437a1bd -j MASQUERADE
-A POSTROUTING -s 172.24.0.0/16 ! -o br-1470a91b9f79 -j MASQUERADE
-A DOCKER ! -i br-d1b395c19330 -p tcp -m tcp --dport 7001 -j DNAT --to-destination 172.20.0.2:7001
-A DOCKER ! -i br-d1b395c19330 -p tcp -m tcp --dport 5140 -j DNAT --to-destination 172.20.0.3:5140
-A DOCKER ! -i br-68cb70ff7627 -p tcp -m tcp --dport 5033 -j DNAT --to-destination 172.22.0.2:5033
-A DOCKER ! -i br-16404437a1bd -p tcp -m tcp --dport 40087 -j DNAT --to-destination 172.18.0.2:40087
-A DOCKER ! -i br-16404437a1bd -p tcp -m tcp --dport 3100 -j DNAT --to-destination 172.18.0.3:8080
-A DOCKER ! -i br-d1b395c19330 -p tcp -m tcp --dport 6099 -j DNAT --to-destination 172.20.0.4:6099
-A DOCKER ! -i br-d1b395c19330 -p tcp -m tcp --dport 6100 -j DNAT --to-destination 172.20.0.4:6100
-A DOCKER ! -i br-16404437a1bd -p tcp -m tcp --dport 5678 -j DNAT --to-destination 172.18.0.4:5678
-A DOCKER ! -i br-16404437a1bd -p tcp -m tcp --dport 3306 -j DNAT --to-destination 172.18.0.5:3306
-A DOCKER ! -i br-ccf8ad7e4352 -p tcp -m tcp --dport 9898 -j DNAT --to-destination 172.23.0.2:9898
-A DOCKER ! -i br-03295b7c56e5 -p tcp -m tcp --dport 3110 -j DNAT --to-destination 172.27.0.2:3000
-A DOCKER ! -i br-16404437a1bd -p tcp -m tcp --dport 40031 -j DNAT --to-destination 172.18.0.6:80
-A DOCKER ! -i br-16404437a1bd -p tcp -m tcp --dport 3001 -j DNAT --to-destination 172.18.0.9:3001
-A DOCKER ! -i br-16404437a1bd -p tcp -m tcp --dport 53 -j DNAT --to-destination 172.18.0.10:53
-A DOCKER ! -i br-16404437a1bd -p udp -m udp --dport 53 -j DNAT --to-destination 172.18.0.10:53
-A DOCKER ! -i br-16404437a1bd -p udp -m udp --dport 20067 -j DNAT --to-destination 172.18.0.10:67
-A DOCKER ! -i br-16404437a1bd -p udp -m udp --dport 20068 -j DNAT --to-destination 172.18.0.10:68
-A DOCKER ! -i br-16404437a1bd -p tcp -m tcp --dport 23000 -j DNAT --to-destination 172.18.0.10:80
-A DOCKER ! -i br-16404437a1bd -p tcp -m tcp --dport 20443 -j DNAT --to-destination 172.18.0.10:443
-A DOCKER ! -i br-16404437a1bd -p udp -m udp --dport 20443 -j DNAT --to-destination 172.18.0.10:443
-A DOCKER ! -i br-16404437a1bd -p udp -m udp --dport 20784 -j DNAT --to-destination 172.18.0.10:784
-A DOCKER ! -i br-16404437a1bd -p tcp -m tcp --dport 853 -j DNAT --to-destination 172.18.0.10:853
-A DOCKER ! -i br-16404437a1bd -p udp -m udp --dport 853 -j DNAT --to-destination 172.18.0.10:853
-A DOCKER ! -i br-16404437a1bd -p tcp -m tcp --dport 23001 -j DNAT --to-destination 172.18.0.10:3000
-A DOCKER ! -i br-16404437a1bd -p tcp -m tcp --dport 5443 -j DNAT --to-destination 172.18.0.10:5443
-A DOCKER ! -i br-16404437a1bd -p udp -m udp --dport 5443 -j DNAT --to-destination 172.18.0.10:5443
-A DOCKER ! -i br-16404437a1bd -p udp -m udp --dport 8853 -j DNAT --to-destination 172.18.0.10:8853
-A DOCKER ! -i br-16404437a1bd -p tcp -m tcp --dport 3000 -j DNAT --to-destination 172.18.0.11:3000
-A DOCKER ! -i br-16404437a1bd -p tcp -m tcp --dport 8089 -j DNAT --to-destination 172.18.0.12:80
-A DOCKER ! -i br-16404437a1bd -p tcp -m tcp --dport 5432 -j DNAT --to-destination 172.18.0.13:5432
-A DOCKER ! -i br-16404437a1bd -p tcp -m tcp --dport 5700 -j DNAT --to-destination 172.18.0.14:5700
-A DOCKER ! -i br-16404437a1bd -p tcp -m tcp --dport 222 -j DNAT --to-destination 172.18.0.15:22
-A DOCKER ! -i br-16404437a1bd -p tcp -m tcp --dport 4000 -j DNAT --to-destination 172.18.0.15:3000
-A DOCKER ! -i br-16404437a1bd -p tcp -m tcp --dport 5244 -j DNAT --to-destination 172.18.0.8:5244
-A DOCKER ! -i br-16404437a1bd -p tcp -m tcp --dport 5246 -j DNAT --to-destination 172.18.0.8:5246
root@CM3588 [00时35分42秒] [/etc/v2raya]
-> # nft -a list ruleset
# Warning: table ip filter is managed by iptables-nft, do not touch!
table ip filter { # handle 1
        chain DOCKER { # handle 3
                ip daddr 172.18.0.8 iifname != "br-16404437a1bd" oifname "br-16404437a1bd" tcp dport 5246 counter packets 0 bytes 0 accept # handle 136
                ip daddr 172.18.0.8 iifname != "br-16404437a1bd" oifname "br-16404437a1bd" tcp dport 5244 counter packets 11 bytes 572 accept # handle 135
                ip daddr 172.18.0.15 iifname != "br-16404437a1bd" oifname "br-16404437a1bd" tcp dport 3000 counter packets 48 bytes 2496 accept # handle 132
                ip daddr 172.18.0.15 iifname != "br-16404437a1bd" oifname "br-16404437a1bd" tcp dport 22 counter packets 0 bytes 0 accept # handle 131
                ip daddr 172.18.0.14 iifname != "br-16404437a1bd" oifname "br-16404437a1bd" tcp dport 5700 counter packets 0 bytes 0 accept # handle 130
                ip daddr 172.18.0.13 iifname != "br-16404437a1bd" oifname "br-16404437a1bd" tcp dport 5432 counter packets 0 bytes 0 accept # handle 129
                ip daddr 172.18.0.12 iifname != "br-16404437a1bd" oifname "br-16404437a1bd" tcp dport 80 counter packets 0 bytes 0 accept # handle 128
                ip daddr 172.18.0.11 iifname != "br-16404437a1bd" oifname "br-16404437a1bd" tcp dport 3000 counter packets 0 bytes 0 accept # handle 127
                ip daddr 172.18.0.10 iifname != "br-16404437a1bd" oifname "br-16404437a1bd" udp dport 8853 counter packets 0 bytes 0 accept # handle 126
                ip daddr 172.18.0.10 iifname != "br-16404437a1bd" oifname "br-16404437a1bd" udp dport 5443 counter packets 0 bytes 0 accept # handle 125
                ip daddr 172.18.0.10 iifname != "br-16404437a1bd" oifname "br-16404437a1bd" tcp dport 5443 counter packets 0 bytes 0 accept # handle 124
                ip daddr 172.18.0.10 iifname != "br-16404437a1bd" oifname "br-16404437a1bd" tcp dport 3000 counter packets 0 bytes 0 accept # handle 123
                ip daddr 172.18.0.10 iifname != "br-16404437a1bd" oifname "br-16404437a1bd" udp dport 853 counter packets 0 bytes 0 accept # handle 122
                ip daddr 172.18.0.10 iifname != "br-16404437a1bd" oifname "br-16404437a1bd" tcp dport 853 counter packets 0 bytes 0 accept # handle 121
                ip daddr 172.18.0.10 iifname != "br-16404437a1bd" oifname "br-16404437a1bd" udp dport 784 counter packets 0 bytes 0 accept # handle 120
                ip daddr 172.18.0.10 iifname != "br-16404437a1bd" oifname "br-16404437a1bd" udp dport 443 counter packets 0 bytes 0 accept # handle 119
                ip daddr 172.18.0.10 iifname != "br-16404437a1bd" oifname "br-16404437a1bd" tcp dport 443 counter packets 0 bytes 0 accept # handle 118
                ip daddr 172.18.0.10 iifname != "br-16404437a1bd" oifname "br-16404437a1bd" tcp dport 80 counter packets 11 bytes 572 accept # handle 117
                ip daddr 172.18.0.10 iifname != "br-16404437a1bd" oifname "br-16404437a1bd" udp dport 68 counter packets 0 bytes 0 accept # handle 116
                ip daddr 172.18.0.10 iifname != "br-16404437a1bd" oifname "br-16404437a1bd" udp dport 67 counter packets 0 bytes 0 accept # handle 115
                ip daddr 172.18.0.10 iifname != "br-16404437a1bd" oifname "br-16404437a1bd" udp dport 53 counter packets 0 bytes 0 accept # handle 114
                ip daddr 172.18.0.10 iifname != "br-16404437a1bd" oifname "br-16404437a1bd" tcp dport 53 counter packets 0 bytes 0 accept # handle 113
                ip daddr 172.18.0.9 iifname != "br-16404437a1bd" oifname "br-16404437a1bd" tcp dport 3001 counter packets 0 bytes 0 accept # handle 112
                ip daddr 172.18.0.6 iifname != "br-16404437a1bd" oifname "br-16404437a1bd" tcp dport 80 counter packets 0 bytes 0 accept # handle 111
                ip daddr 172.27.0.2 iifname != "br-03295b7c56e5" oifname "br-03295b7c56e5" tcp dport 3000 counter packets 0 bytes 0 accept # handle 108
                ip daddr 172.23.0.2 iifname != "br-ccf8ad7e4352" oifname "br-ccf8ad7e4352" tcp dport 9898 counter packets 0 bytes 0 accept # handle 107
                ip daddr 172.18.0.5 iifname != "br-16404437a1bd" oifname "br-16404437a1bd" tcp dport 3306 counter packets 0 bytes 0 accept # handle 106
                ip daddr 172.18.0.4 iifname != "br-16404437a1bd" oifname "br-16404437a1bd" tcp dport 5678 counter packets 0 bytes 0 accept # handle 105
                ip daddr 172.20.0.4 iifname != "br-d1b395c19330" oifname "br-d1b395c19330" tcp dport 6100 counter packets 0 bytes 0 accept # handle 104
                ip daddr 172.20.0.4 iifname != "br-d1b395c19330" oifname "br-d1b395c19330" tcp dport 6099 counter packets 0 bytes 0 accept # handle 103
                ip daddr 172.18.0.3 iifname != "br-16404437a1bd" oifname "br-16404437a1bd" tcp dport 8080 counter packets 45 bytes 2340 accept # handle 102
                ip daddr 172.18.0.2 iifname != "br-16404437a1bd" oifname "br-16404437a1bd" tcp dport 40087 counter packets 0 bytes 0 accept # handle 101
                ip daddr 172.22.0.2 iifname != "br-68cb70ff7627" oifname "br-68cb70ff7627" tcp dport 5033 counter packets 0 bytes 0 accept # handle 100
                ip daddr 172.20.0.3 iifname != "br-d1b395c19330" oifname "br-d1b395c19330" tcp dport 5140 counter packets 0 bytes 0 accept # handle 99
                ip daddr 172.20.0.2 iifname != "br-d1b395c19330" oifname "br-d1b395c19330" tcp dport 7001 counter packets 0 bytes 0 accept # handle 98
                iifname != "br-1470a91b9f79" oifname "br-1470a91b9f79" counter packets 0 bytes 0 drop # handle 14
                iifname != "br-16404437a1bd" oifname "br-16404437a1bd" counter packets 0 bytes 0 drop # handle 18
                iifname != "br-35578642c035" oifname "br-35578642c035" counter packets 0 bytes 0 drop # handle 22
                iifname != "br-68cb70ff7627" oifname "br-68cb70ff7627" counter packets 0 bytes 0 drop # handle 26
                iifname != "br-c8a4b7f1f49e" oifname "br-c8a4b7f1f49e" counter packets 0 bytes 0 drop # handle 30
                iifname != "br-ccf8ad7e4352" oifname "br-ccf8ad7e4352" counter packets 0 bytes 0 drop # handle 34
                iifname != "br-d1b395c19330" oifname "br-d1b395c19330" counter packets 0 bytes 0 drop # handle 38
                iifname != "br-dabddbedac96" oifname "br-dabddbedac96" counter packets 0 bytes 0 drop # handle 46
                iifname != "br-f9fb79b556fe" oifname "br-f9fb79b556fe" counter packets 0 bytes 0 drop # handle 50
                iifname != "br-03295b7c56e5" oifname "br-03295b7c56e5" counter packets 0 bytes 0 drop # handle 54
                iifname != "docker0" oifname "docker0" counter packets 0 bytes 0 drop # handle 95
        }

        chain DOCKER-FORWARD { # handle 4
                counter packets 2204322 bytes 1253044173 jump DOCKER-CT # handle 12
                counter packets 1236777 bytes 344469612 jump DOCKER-INTERNAL # handle 11
                counter packets 1236777 bytes 344469612 jump DOCKER-BRIDGE # handle 10
                iifname "br-1470a91b9f79" counter packets 0 bytes 0 accept # handle 13
                iifname "br-16404437a1bd" counter packets 34407 bytes 9489978 accept # handle 17
                iifname "br-35578642c035" counter packets 0 bytes 0 accept # handle 21
                iifname "br-68cb70ff7627" counter packets 0 bytes 0 accept # handle 25
                iifname "br-c8a4b7f1f49e" counter packets 0 bytes 0 accept # handle 29
                iifname "br-ccf8ad7e4352" counter packets 986280 bytes 278286517 accept # handle 33
                iifname "br-d1b395c19330" counter packets 213777 bytes 56393029 accept # handle 37
                iifname "br-dabddbedac96" counter packets 0 bytes 0 accept # handle 45
                iifname "br-f9fb79b556fe" counter packets 0 bytes 0 accept # handle 49
                iifname "br-03295b7c56e5" counter packets 2196 bytes 294004 accept # handle 53
                iifname "docker0" counter packets 0 bytes 0 accept # handle 94
        }

        chain DOCKER-BRIDGE { # handle 5
                oifname "br-1470a91b9f79" counter packets 0 bytes 0 jump DOCKER # handle 16
                oifname "br-16404437a1bd" counter packets 117 bytes 6084 jump DOCKER # handle 20
                oifname "br-35578642c035" counter packets 0 bytes 0 jump DOCKER # handle 24
                oifname "br-68cb70ff7627" counter packets 0 bytes 0 jump DOCKER # handle 28
                oifname "br-c8a4b7f1f49e" counter packets 0 bytes 0 jump DOCKER # handle 32
                oifname "br-ccf8ad7e4352" counter packets 0 bytes 0 jump DOCKER # handle 36
                oifname "br-d1b395c19330" counter packets 0 bytes 0 jump DOCKER # handle 40
                oifname "br-dabddbedac96" counter packets 0 bytes 0 jump DOCKER # handle 48
                oifname "br-f9fb79b556fe" counter packets 0 bytes 0 jump DOCKER # handle 52
                oifname "br-03295b7c56e5" counter packets 0 bytes 0 jump DOCKER # handle 56
                oifname "docker0" counter packets 0 bytes 0 jump DOCKER # handle 97
        }

        chain DOCKER-CT { # handle 6
                oifname "br-1470a91b9f79" ct state related,established counter packets 0 bytes 0 accept # handle 15
                oifname "br-16404437a1bd" ct state related,established counter packets 36440 bytes 11688226 accept # handle 19
                oifname "br-35578642c035" ct state related,established counter packets 0 bytes 0 accept # handle 23
                oifname "br-68cb70ff7627" ct state related,established counter packets 0 bytes 0 accept # handle 27
                oifname "br-c8a4b7f1f49e" ct state related,established counter packets 0 bytes 0 accept # handle 31
                oifname "br-ccf8ad7e4352" ct state related,established counter packets 780923 bytes 858390354 accept # handle 35
                oifname "br-d1b395c19330" ct state related,established counter packets 148166 bytes 35607387 accept # handle 39
                oifname "br-dabddbedac96" ct state related,established counter packets 0 bytes 0 accept # handle 47
                oifname "br-f9fb79b556fe" ct state related,established counter packets 0 bytes 0 accept # handle 51
                oifname "br-03295b7c56e5" ct state related,established counter packets 2016 bytes 2888594 accept # handle 55
                oifname "docker0" ct state related,established counter packets 0 bytes 0 accept # handle 96
        }

        chain DOCKER-INTERNAL { # handle 7
        }

        chain FORWARD { # handle 8
                type filter hook forward priority filter; policy accept;
                counter packets 2204320 bytes 1253044069 jump DOCKER-USER # handle 93
                counter packets 2204322 bytes 1253044173 jump DOCKER-FORWARD # handle 9
        }

        chain DOCKER-USER { # handle 92
        }
}
# Warning: table ip nat is managed by iptables-nft, do not touch!
table ip nat { # handle 2
        chain DOCKER { # handle 2
                iifname != "br-d1b395c19330" tcp dport 7001 counter packets 0 bytes 0 dnat to 172.20.0.2:7001 # handle 55
                iifname != "br-d1b395c19330" tcp dport 5140 counter packets 0 bytes 0 dnat to 172.20.0.3:5140 # handle 56
                iifname != "br-68cb70ff7627" tcp dport 5033 counter packets 0 bytes 0 dnat to 172.22.0.2:5033 # handle 57
                iifname != "br-16404437a1bd" tcp dport 40087 counter packets 0 bytes 0 dnat to 172.18.0.2:40087 # handle 58
                iifname != "br-16404437a1bd" tcp dport 3100 counter packets 45 bytes 2340 dnat to 172.18.0.3:8080 # handle 59
                iifname != "br-d1b395c19330" tcp dport 6099 counter packets 0 bytes 0 dnat to 172.20.0.4:6099 # handle 60
                iifname != "br-d1b395c19330" tcp dport 6100 counter packets 0 bytes 0 dnat to 172.20.0.4:6100 # handle 61
                iifname != "br-16404437a1bd" tcp dport 5678 counter packets 0 bytes 0 dnat to 172.18.0.4:5678 # handle 62
                iifname != "br-16404437a1bd" tcp dport 3306 counter packets 0 bytes 0 dnat to 172.18.0.5:3306 # handle 63
                iifname != "br-ccf8ad7e4352" tcp dport 9898 counter packets 0 bytes 0 dnat to 172.23.0.2:9898 # handle 64
                iifname != "br-03295b7c56e5" tcp dport 3110 counter packets 0 bytes 0 dnat to 172.27.0.2:3000 # handle 65
                iifname != "br-16404437a1bd" tcp dport 40031 counter packets 0 bytes 0 dnat to 172.18.0.6:80 # handle 68
                iifname != "br-16404437a1bd" tcp dport 3001 counter packets 0 bytes 0 dnat to 172.18.0.9:3001 # handle 69
                iifname != "br-16404437a1bd" tcp dport 53 counter packets 0 bytes 0 dnat to 172.18.0.10:53 # handle 70
                iifname != "br-16404437a1bd" udp dport 53 counter packets 0 bytes 0 dnat to 172.18.0.10:53 # handle 71
                iifname != "br-16404437a1bd" udp dport 20067 counter packets 0 bytes 0 dnat to 172.18.0.10:67 # handle 72
                iifname != "br-16404437a1bd" udp dport 20068 counter packets 0 bytes 0 dnat to 172.18.0.10:68 # handle 73
                iifname != "br-16404437a1bd" tcp dport 23000 counter packets 11 bytes 572 dnat to 172.18.0.10:80 # handle 74
                iifname != "br-16404437a1bd" tcp dport 20443 counter packets 0 bytes 0 dnat to 172.18.0.10:443 # handle 75
                iifname != "br-16404437a1bd" udp dport 20443 counter packets 0 bytes 0 dnat to 172.18.0.10:443 # handle 76
                iifname != "br-16404437a1bd" udp dport 20784 counter packets 0 bytes 0 dnat to 172.18.0.10:784 # handle 77
                iifname != "br-16404437a1bd" tcp dport 853 counter packets 0 bytes 0 dnat to 172.18.0.10:853 # handle 78
                iifname != "br-16404437a1bd" udp dport 853 counter packets 0 bytes 0 dnat to 172.18.0.10:853 # handle 79
                iifname != "br-16404437a1bd" tcp dport 23001 counter packets 0 bytes 0 dnat to 172.18.0.10:3000 # handle 80
                iifname != "br-16404437a1bd" tcp dport 5443 counter packets 0 bytes 0 dnat to 172.18.0.10:5443 # handle 81
                iifname != "br-16404437a1bd" udp dport 5443 counter packets 0 bytes 0 dnat to 172.18.0.10:5443 # handle 82
                iifname != "br-16404437a1bd" udp dport 8853 counter packets 0 bytes 0 dnat to 172.18.0.10:8853 # handle 83
                iifname != "br-16404437a1bd" tcp dport 3000 counter packets 0 bytes 0 dnat to 172.18.0.11:3000 # handle 84
                iifname != "br-16404437a1bd" tcp dport 8089 counter packets 0 bytes 0 dnat to 172.18.0.12:80 # handle 85
                iifname != "br-16404437a1bd" tcp dport 5432 counter packets 0 bytes 0 dnat to 172.18.0.13:5432 # handle 86
                iifname != "br-16404437a1bd" tcp dport 5700 counter packets 0 bytes 0 dnat to 172.18.0.14:5700 # handle 87
                iifname != "br-16404437a1bd" tcp dport 222 counter packets 0 bytes 0 dnat to 172.18.0.15:22 # handle 88
                iifname != "br-16404437a1bd" tcp dport 4000 counter packets 48 bytes 2496 dnat to 172.18.0.15:3000 # handle 89
                iifname != "br-16404437a1bd" tcp dport 5244 counter packets 11 bytes 572 dnat to 172.18.0.8:5244 # handle 92
                iifname != "br-16404437a1bd" tcp dport 5246 counter packets 0 bytes 0 dnat to 172.18.0.8:5246 # handle 93
        }

        chain PREROUTING { # handle 3
                type nat hook prerouting priority dstnat; policy accept;
                tcp dport 53 counter packets 0 bytes 0 redirect to :52353 # handle 131
                udp dport 53 counter packets 0 bytes 0 redirect to :52353 # handle 130
                fib daddr type local counter packets 674 bytes 47177 jump DOCKER # handle 4
        }

        chain OUTPUT { # handle 5
                type nat hook output priority dstnat; policy accept;
                tcp dport 53 counter packets 0 bytes 0 redirect to :52353 # handle 133
                udp dport 53 counter packets 5666 bytes 342275 redirect to :52353 # handle 132
                ip daddr != 127.0.0.0/8 fib daddr type local counter packets 7127 bytes 416027 jump DOCKER # handle 6
        }

        chain POSTROUTING { # handle 7
                type nat hook postrouting priority srcnat; policy accept;
                ip saddr 172.17.0.0/16 oifname != "docker0" counter packets 0 bytes 0 masquerade # handle 54
                ip saddr 172.27.0.0/16 oifname != "br-03295b7c56e5" counter packets 37 bytes 2220 masquerade # handle 18
                ip saddr 172.19.0.0/16 oifname != "br-f9fb79b556fe" counter packets 0 bytes 0 masquerade # handle 17
                ip saddr 172.25.0.0/16 oifname != "br-dabddbedac96" counter packets 0 bytes 0 masquerade # handle 16
                ip saddr 172.20.0.0/16 oifname != "br-d1b395c19330" counter packets 1962 bytes 118230 masquerade # handle 14
                ip saddr 172.23.0.0/16 oifname != "br-ccf8ad7e4352" counter packets 26639 bytes 1597226 masquerade # handle 13
                ip saddr 172.26.0.0/16 oifname != "br-c8a4b7f1f49e" counter packets 0 bytes 0 masquerade # handle 12
                ip saddr 172.22.0.0/16 oifname != "br-68cb70ff7627" counter packets 0 bytes 0 masquerade # handle 11
                ip saddr 172.21.0.0/16 oifname != "br-35578642c035" counter packets 0 bytes 0 masquerade # handle 10
                ip saddr 172.18.0.0/16 oifname != "br-16404437a1bd" counter packets 2529 bytes 152410 masquerade # handle 9
                ip saddr 172.24.0.0/16 oifname != "br-1470a91b9f79" counter packets 0 bytes 0 masquerade # handle 8
        }
}
table ip6 filter { # handle 3
        chain DOCKER { # handle 3
        }

        chain DOCKER-FORWARD { # handle 4
                counter packets 0 bytes 0 jump DOCKER-CT # handle 12
                counter packets 0 bytes 0 jump DOCKER-INTERNAL # handle 11
                counter packets 0 bytes 0 jump DOCKER-BRIDGE # handle 10
        }

        chain DOCKER-BRIDGE { # handle 5
        }

        chain DOCKER-CT { # handle 6
        }

        chain DOCKER-INTERNAL { # handle 7
        }

        chain FORWARD { # handle 8
                type filter hook forward priority filter; policy accept;
                counter packets 0 bytes 0 jump DOCKER-USER # handle 14
                counter packets 0 bytes 0 jump DOCKER-FORWARD # handle 9
        }

        chain DOCKER-USER { # handle 13
        }
}
# Warning: table ip6 nat is managed by iptables-nft, do not touch!
table ip6 nat { # handle 4
        chain DOCKER { # handle 2
        }

        chain PREROUTING { # handle 3
                type nat hook prerouting priority dstnat; policy accept;
                tcp dport 53 counter packets 0 bytes 0 # Warning: XT target REDIRECT not found
xt target "REDIRECT" # handle 44
                udp dport 53 counter packets 0 bytes 0 # Warning: XT target REDIRECT not found
xt target "REDIRECT" # handle 43
                fib daddr type local counter packets 0 bytes 0 jump DOCKER # handle 4
        }

        chain OUTPUT { # handle 5
                type nat hook output priority dstnat; policy accept;
                tcp dport 53 counter packets 0 bytes 0 # Warning: XT target REDIRECT not found
xt target "REDIRECT" # handle 46
                udp dport 53 counter packets 2835 bytes 227950 # Warning: XT target REDIRECT not found
xt target "REDIRECT" # handle 45
                ip6 daddr != ::1 fib daddr type local counter packets 0 bytes 0 jump DOCKER # handle 6
        }
}
table ip raw { # handle 5
        chain PREROUTING { # handle 1
                type filter hook prerouting priority raw; policy accept;
                ip daddr 172.20.0.2 iifname != "br-d1b395c19330" counter packets 0 bytes 0 drop # handle 24
                ip daddr 172.20.0.3 iifname != "br-d1b395c19330" counter packets 0 bytes 0 drop # handle 25
                ip daddr 172.18.0.2 iifname != "br-16404437a1bd" counter packets 0 bytes 0 drop # handle 26
                ip daddr 172.22.0.2 iifname != "br-68cb70ff7627" counter packets 0 bytes 0 drop # handle 27
                ip daddr 172.18.0.3 iifname != "br-16404437a1bd" counter packets 0 bytes 0 drop # handle 28
                ip daddr 172.18.0.4 iifname != "br-16404437a1bd" counter packets 0 bytes 0 drop # handle 29
                ip daddr 172.20.0.4 iifname != "br-d1b395c19330" counter packets 0 bytes 0 drop # handle 30
                ip daddr 172.18.0.5 iifname != "br-16404437a1bd" counter packets 0 bytes 0 drop # handle 31
                ip daddr 172.27.0.2 iifname != "br-03295b7c56e5" counter packets 0 bytes 0 drop # handle 32
                ip daddr 172.23.0.2 iifname != "br-ccf8ad7e4352" counter packets 0 bytes 0 drop # handle 33
                ip daddr 172.27.0.3 iifname != "br-03295b7c56e5" counter packets 0 bytes 0 drop # handle 34
                ip daddr 172.18.0.6 iifname != "br-16404437a1bd" counter packets 0 bytes 0 drop # handle 35
                ip daddr 172.27.0.4 iifname != "br-03295b7c56e5" counter packets 0 bytes 0 drop # handle 36
                ip daddr 172.18.0.9 iifname != "br-16404437a1bd" counter packets 0 bytes 0 drop # handle 39
                ip daddr 172.18.0.10 iifname != "br-16404437a1bd" counter packets 11 bytes 1341 drop # handle 40
                ip daddr 172.18.0.11 iifname != "br-16404437a1bd" counter packets 0 bytes 0 drop # handle 41
                ip daddr 172.18.0.12 iifname != "br-16404437a1bd" counter packets 0 bytes 0 drop # handle 42
                ip daddr 172.18.0.13 iifname != "br-16404437a1bd" counter packets 0 bytes 0 drop # handle 43
                ip daddr 172.18.0.14 iifname != "br-16404437a1bd" counter packets 0 bytes 0 drop # handle 44
                ip daddr 172.18.0.15 iifname != "br-16404437a1bd" counter packets 0 bytes 0 drop # handle 45
                ip daddr 172.18.0.8 iifname != "br-16404437a1bd" counter packets 0 bytes 0 drop # handle 49
                ip daddr 172.18.0.7 iifname != "br-16404437a1bd" counter packets 0 bytes 0 drop # handle 52
        }

```
</details>

**Comment by lemenju** [comment]
这是同一个 bug（TPROXY 模式下多余的 nat REDIRECT DNS 规则破坏 UDP DNS）。下面是完整的原因分析和一个临时解决办法。 Same bug as this discussion. Below is a full root-cause analysis and a workaround.

I ran into the exact same problem — the nat REDIRECT rules for dport 53 -> :52353 block all UDP DNS, and they are not cleaned up when disabling/stopping v2rayA. Here is what's going on and how to work around it.

TL;DR

In TPROXY mode v2rayA installs two DNS-hijack mechanisms at the same time:

The correct native nftables table inet v2raya, which already handles DNS via TPROXY (dport 53 tproxy to 127.2.0.17:52353).
A redundant legacy hijack via iptables -j REDIRECT (ip nat / ip6 nat, dport 53 -> :52353).

On systems using the nftables backend (iptables-nft, i.e. modern Debian/Ubuntu), the second mechanism is broken and takes down all UDP DNS:

IPv6: the REDIRECT xt-target doesn't exist in the iptables-nft layer — the rules are dead (Warning: XT target REDIRECT not found).
IPv4: the NAT REDIRECT of UDP/53 breaks the conntrack return path, so UDP DNS replies never come back → every UDP query times out.

TCP proxying is unaffected. The ip nat REDIRECT rules are also not removed on stop/disable, so DNS stays broken until reboot.

Environment
OS: Debian 13 (trixie) — also reproduced by OP on Ubuntu 24.04
Firewall backend: nftables (iptables provided by iptables-nft)
Core: Xray 26.3.27
Transparent proxy mode: TPROXY
v2rayA version: 2.4.9
Symptom

After connecting, all UDP DNS queries time out:

$ dig google.com
;; communications error to 127.2.0.17#53: timed out

$ dig google.com @10.64.1.251      # a reachable LAN DNS server
;; communications error to 10.64.1.251#53: timed out

It is not about which DNS server is configured — even a direct query to a reachable LAN resolver times out, because all dport 53 is hijacked.

The two conflicting rule sets

Correct, expected (native nftables):

table inet v2raya {
    chain tp_pre {
        ...
        ... th dport 53 tproxy ip  to 127.2.0.17:52353
        ... th dport 53 tproxy ip6 to [::1]:52353
        ...
    }
}

Redundant / broken (the bug):

# Warning: table ip nat is managed by iptables-nft, do not touch!
table ip nat {
    chain PREROUTING {
        type nat hook prerouting priority dstnat; policy accept;
        tcp dport 53 redirect to :52353
        udp dport 53 redirect to :52353
    }
    chain OUTPUT {
        type nat hook output priority dstnat; policy accept;
        tcp dport 53 redirect to :52353
        udp dport 53 redirect to :52353
    }
}
# Warning: table ip6 nat is managed by iptables-nft, do not touch!
table ip6 nat {
    chain PREROUTING {
        tcp dport 53 # Warning: XT target REDIRECT not found
        udp dport 53 # Warning: XT target REDIRECT not found
    }
    chain OUTPUT {
        tcp dport 53 # Warning: XT target REDIRECT not found
        udp dport 53 # Warning: XT target REDIRECT not found
    }
}
Proof that the REDIRECT rules are the cause

Flushing only the redundant NAT rules (while still connected) immediately restores DNS via the TPROXY path:

$ sudo iptables -t nat -F
$ sudo ip6tables -t nat -F
$ dig google.com
;; ->>HEADER<<- opcode: QUERY, status: NOERROR
;; SERVER: 127.2.0.17#53(127.2.0.17) (UDP)
google.com. 244 IN A 142.251.13.102
...

Everything (proxy + DNS) keeps working afterwards, which shows the nat REDIRECT rules are pure overhead in TPROXY mode.

Why "it used to work"

On older systems using iptables-legacy, the REDIRECT target works, so the duplicate rules were merely redundant instead of harmful. The move to the nftables backend (iptables-nft) is what turns them into a hard breakage.

A system-wide alternative is to switch the backend back to legacy:

sudo update-alternatives --set iptables  /usr/sbin/iptables-legacy
sudo update-alternatives --set ip6tables /usr/sbin/ip6tables-legacy

but this affects the whole firewall, so it's not ideal.

Suggested fix

In TPROXY mode the native inet v2raya rules already handle DNS. The additional iptables -j REDIRECT DNS hijack should not be installed in TPROXY mode; if it is intended, it should be implemented as native nftables rules (no legacy xt REDIRECT target) and must be included in the teardown routine so it is removed on stop/disable.

Workaround (scoped, survives reconnect and reboot)

A small systemd watcher that strips the NAT rules whenever they reappear — the TPROXY path handles DNS on its own:

/usr/local/sbin/v2raya-dns-nat-clean.sh:

bash
#!/bin/bash
strip() { iptables -t nat -F; ip6tables -t nat -F; }
strip
while true; do
    if nft list table ip nat  2>/dev/null | grep -q 'dport 53'; then strip; fi
    if nft list table ip6 nat 2>/dev/null | grep -q 'dport 53'; then ip6tables -t nat -F; fi
    sleep 1
done

/etc/systemd/system/v2raya-dns-fix.service:

ini
[Unit]
Description=Strip v2rayA duplicate DNS nat-redirect (breaks UDP DNS on nftables)
After=v2raya.service

[Service]
Type=simple
ExecStart=/usr/local/sbin/v2raya-dns-nat-clean.sh
Restart=always

[Install]
WantedBy=multi-user.target
bash
sudo systemctl daemon-reload
sudo systemctl enable --now v2raya-dns-fix.service

⚠️ Note: if you run Docker, your nat table also contains Docker's own rules (jump DOCKER). iptables -t nat -F flushes those too. On a Docker host, delete only the specific DNS-redirect rules instead of flushing the whole table.

**Reply by ltxhhz** [reply]
Thanks for your reply, but I think this isn't a good solution, because even though the V2rayA service is running, DNS is still not working properly. The V2rayA-core will send DNS requests non-stop, about 250,000 times per minute.

<details>
<summary>log</summary>

```
01:05:22.477853 lo    In  IP 223.5.5.5.53 > 192.168.31.102.44400: 21412 ServFail- 0/0/0 (27)
01:05:22.478882 lo    In  IP 223.5.5.5.53 > 192.168.31.102.59003: 56497 ServFail- 0/0/0 (27)
01:05:22.479317 lo    In  IP 223.5.5.5.53 > 192.168.31.102.47445: 46315 ServFail- 0/0/0 (27)
01:05:22.479378 lo    In  IP 223.5.5.5.53 > 192.168.31.102.44735: 59610 ServFail- 0/0/0 (27)
01:05:22.479432 lo    In  IP 223.5.5.5.53 > 192.168.31.102.52108: 39605 ServFail- 0/0/0 (27)
01:05:22.479479 lo    In  IP 223.5.5.5.53 > 192.168.31.102.52153: 34949 ServFail- 0/0/0 (27)
01:05:22.479526 lo    In  IP 223.5.5.5.53 > 192.168.31.102.39849: 55113 ServFail- 0/0/0 (27)
01:05:22.479567 lo    In  IP 223.5.5.5.53 > 192.168.31.102.56948: 59896 ServFail- 0/0/0 (27)
01:05:22.479621 lo    In  IP 223.5.5.5.53 > 192.168.31.102.52553: 32502 ServFail- 0/0/0 (27)
01:05:22.480347 eth0  Out IP 192.168.31.102.47437 > 223.5.5.5.53: 18727+ [1au] A? baidu.com. (49)
01:05:22.480623 lo    In  IP 223.5.5.5.53 > 192.168.31.102.41985: 45755 ServFail- 0/0/0 (27)
01:05:22.480677 lo    In  IP 223.5.5.5.53 > 192.168.31.102.47008: 26123 ServFail- 0/0/0 (27)
01:05:22.480776 lo    In  IP 223.5.5.5.53 > 192.168.31.102.37279: 50987 ServFail- 0/0/0 (27)
01:05:22.480822 lo    In  IP 223.5.5.5.53 > 192.168.31.102.38332: 9994 ServFail- 0/0/0 (27)
01:05:22.480875 lo    In  IP 223.5.5.5.53 > 192.168.31.102.48683: 62351 ServFail- 0/0/0 (27)
01:05:22.482186 lo    In  IP 223.5.5.5.53 > 192.168.31.102.55374: 138 ServFail- 0/0/0 (27)
01:05:22.482473 lo    In  IP 223.5.5.5.53 > 192.168.31.102.43438: 21128 ServFail- 0/0/0 (27)
01:05:22.482963 lo    In  IP 223.5.5.5.53 > 192.168.31.102.45573: 42719 ServFail- 0/0/0 (27)
01:05:22.483011 lo    In  IP 223.5.5.5.53 > 192.168.31.102.50349: 17916 ServFail- 0/0/0 (27)
01:05:22.483035 lo    In  IP 223.5.5.5.53 > 192.168.31.102.38348: 3421 ServFail- 0/0/0 (27)
01:05:22.483059 lo    In  IP 223.5.5.5.53 > 192.168.31.102.44129: 19520 ServFail- 0/0/0 (27)
01:05:22.483076 lo    In  IP 223.5.5.5.53 > 192.168.31.102.51231: 45347 ServFail- 0/0/0 (27)
01:05:22.483097 lo    In  IP 223.5.5.5.53 > 192.168.31.102.54102: 57590 ServFail- 0/0/0 (27)
01:05:22.484020 lo    In  IP 223.5.5.5.53 > 192.168.31.102.41245: 56888 ServFail- 0/0/0 (27)
01:05:22.484982 eth0  In  IP 223.5.5.5.53 > 192.168.31.102.47437: 18727 4/5/1 A 124.237.177.164, A 110.242.74.102, A 111.63.65.247, A 111.63.65.103 (192)
01:05:22.485467 lo    In  IP 223.5.5.5.53 > 192.168.31.102.56099: 46270 ServFail- 0/0/0 (27)
01:05:22.486669 lo    In  IP 223.5.5.5.53 > 192.168.31.102.58690: 19648 ServFail- 0/0/0 (27)
01:05:22.487919 lo    In  IP 223.5.5.5.53 > 192.168.31.102.52479: 39972 ServFail- 0/0/0 (27)
01:05:22.487967 lo    In  IP 223.5.5.5.53 > 192.168.31.102.34434: 4180 ServFail- 0/0/0 (27)
01:05:22.488021 lo    In  IP 223.5.5.5.53 > 192.168.31.102.43593: 29338 ServFail- 0/0/0 (27)
01:05:22.488064 lo    In  IP 223.5.5.5.53 > 192.168.31.102.39415: 17615 ServFail- 0/0/0 (27)
01:05:22.488110 lo    In  IP 223.5.5.5.53 > 192.168.31.102.57988: 22088 ServFail- 0/0/0 (27)
01:05:22.489770 lo    In  IP 223.5.5.5.53 > 192.168.31.102.54210: 16788 ServFail- 0/0/0 (27)
01:05:22.489871 lo    In  IP 223.5.5.5.53 > 192.168.31.102.33207: 14655 ServFail- 0/0/0 (27)
01:05:22.489979 lo    In  IP 223.5.5.5.53 > 192.168.31.102.36512: 47140 ServFail- 0/0/0 (27)
01:05:22.493264 lo    In  IP 223.5.5.5.53 > 192.168.31.102.41762: 23572 ServFail- 0/0/0 (27)
01:05:22.498227 lo    In  IP 223.5.5.5.53 > 192.168.31.102.40384: 6311 ServFail- 0/0/0 (27)
01:05:22.498337 eth0  Out IP 192.168.31.102.47437 > 223.5.5.5.53: 2182+ [1au] A? baidu.com. (49)
01:05:22.498995 lo    In  IP 223.5.5.5.53 > 192.168.31.102.38218: 4968 ServFail- 0/0/0 (27)
01:05:22.499155 lo    In  IP 223.5.5.5.53 > 192.168.31.102.42561: 41059 ServFail- 0/0/0 (27)
01:05:22.503647 lo    In  IP 223.5.5.5.53 > 192.168.31.102.32918: 33418 ServFail- 0/0/0 (27)
01:05:22.504443 eth0  In  IP 223.5.5.5.53 > 192.168.31.102.47437: 2182 4/5/1 A 111.63.65.103, A 124.237.177.164, A 111.63.65.247, A 110.242.74.102 (192)
01:05:22.507191 lo    In  IP 223.5.5.5.53 > 192.168.31.102.56280: 47387 ServFail- 0/0/0 (27)
01:05:22.510813 lo    In  IP 223.5.5.5.53 > 192.168.31.102.46893: 49957 ServFail- 0/0/0 (27)
01:05:22.521967 lo    In  IP 223.5.5.5.53 > 192.168.31.102.40224: 46733 ServFail- 0/0/0 (27)
01:05:22.529856 lo    In  IP 223.5.5.5.53 > 192.168.31.102.49932: 34458 ServFail- 0/0/0 (27)
01:05:22.530256 lo    In  IP 223.5.5.5.53 > 192.168.31.102.50538: 38660 4/5/1 A 111.63.65.103, A 124.237.177.164, A 111.63.65.247, A 110.242.74.102 (318)
01:05:22.530476 lo    In  IP 223.5.5.5.53 > 192.168.31.102.42293: 52378 ServFail- 0/0/0 (27)
01:05:22.530660 lo    In  IP 223.5.5.5.53 > 192.168.31.102.39629: 21448 ServFail- 0/0/0 (27)
01:05:22.530969 lo    In  IP 223.5.5.5.53 > 192.168.31.102.53036: 7174 ServFail- 0/0/0 (27)
01:05:22.531247 eth0  Out IP 192.168.31.102.47437 > 223.5.5.5.53: 59751+ [1au] A? baidu.com. (49)
01:05:22.532525 lo    In  IP 223.5.5.5.53 > 192.168.31.102.42654: 50323 ServFail- 0/0/0 (27)
01:05:22.536379 eth0  In  IP 223.5.5.5.53 > 192.168.31.102.47437: 59751 4/5/1 A 111.63.65.103, A 110.242.74.102, A 111.63.65.247, A 124.237.177.164 (192)
01:05:22.546879 lo    In  IP 223.5.5.5.53 > 192.168.31.102.43491: 12064 ServFail- 0/0/0 (27
```
</details>

**Reply by lemenju** [reply]
This is a bug report; it is not a permanent solution

**Reply by lemenju** [reply, marked as answer]
Fixed.

Thank you
