### ISSUE TITLE
PC 做旁路由 IP 转发无效

### ISSUE THREAD

**Issue by AAlieZZ** [v2rayA/v2rayA#855]
### 版本、安装方式、系统

1. 你在使用什么版本的v2rayA
```
# v2raya --version
2.0.4
```
2. 你通过什么方式安装v2rayA
```
paru v2ray-bin
```
3. 你所使用的操作系统
```
# uname -a
Linux archlinux 6.2.6-arch1-g14-1 #6 SMP PREEMPT_DYNAMIC Mon, 13 Mar 2023 18:19:03 +0000 x86_64 GNU/Linux
```

### 描述问题：

PC 端开启透明代理和 IP 转发，手机 WiFi 设置网关为 PC 的 IP，手机并没有走代理，且 V2rayA 日志没有任何手机的记录。
对照组：用树莓派替换 PC 进行同样的操作，手机走代理。

### v2rayA运行日志（Optional）：

 ```bash
 # daemon mode
 journalctl -u v2raya | tail -n 50
3月 20 06:57:23 archlinux systemd[1]: Started v2rayA Service.
3月 20 07:14:02 archlinux systemd[1]: Stopping v2rayA Service...
3月 20 07:14:02 archlinux v2raya[602]: Quitting...
3月 20 07:14:02 archlinux systemd[1]: v2raya.service: Deactivated successfully.
3月 20 07:14:02 archlinux systemd[1]: Stopped v2rayA Service.
3月 20 07:14:02 archlinux systemd[1]: v2raya.service: Consumed 3.154s CPU time.
 ```

**Comment by mzz2017** [comment]
树莓派也是2.0.4吗

**Comment by AAlieZZ** [comment]
> 树莓派也是2.0.4吗

不，是 2.0.1，但是 PC 也用 2.0.1 照样不行

**Comment by mzz2017** [comment]
2.0.1，pc用上之后自己能代理是吧

**Comment by AAlieZZ** [comment]
> 2.0.1，pc用上之后自己能代理是吧

能，PC 自己一切正常。

**Comment by mzz2017** [comment]
@AAlieZZ 你端口分享开了吗，防火墙关了吗，设置贴一下，日志别发运行的，看看/var/log/v2raya/v2raya.log

**Comment by AAlieZZ** [comment]
> 你端口分享开了吗

是的，测试端口分享正常，手机可以通过 PC 的 HTTP 和 Socks5 走代理。

> 防火墙关了吗

没有防火墙。

> 看看/var/log/v2raya/v2raya.log

```
2023/03/20 16:30:29.950  [I] [io.go:429]  V2Ray 5.3.0 (V2Fly, a community-driven edition of V2Ray.) Custom (go1.20 linux/amd64)
2023/03/20 16:30:29.951  [I] [io.go:429]  A unified platform for anti-censorship.
2023/03/20 16:30:30.639  [I] [io.go:429]  127.0.0.1:55006 accepted tcp:127.0.0.1:0 [api-out]
2023/03/20 16:30:40.761  [I] [io.go:429]  tcp:127.0.0.1:53048 accepted tcp:alive.github.com:443 [proxy]
2023/03/20 16:30:47.804  [I] [io.go:429]  tcp:127.0.0.1:38380 accepted tcp:push.services.mozilla.com:443 [proxy]
2023/03/20 16:30:49.153  [I] [io.go:429]  tcp:127.0.0.1:38386 accepted tcp:firefox.settings.services.mozilla.com:443 [proxy]
2023/03/20 16:30:50.412  [I] [io.go:429]  tcp:127.0.0.1:38388 accepted tcp:content-signature-2.cdn.mozilla.net:443 [proxy]
2023/03/20 16:31:09.800  [I] [io.go:429]  10.64.198.171:58719 accepted udp:192.168.0.1:53 [dns-out]
```
并没有任何来自手机的记录。

**Comment by mzz2017** [comment]
手机怎么设置的，表现成什么，连国内是直连还是说网络不通

**Comment by AAlieZZ** [comment]
> 手机怎么设置的，表现成什么，连国内是直连还是说网络不通

设置-WiFi-把DHCP改成静态-设置网关为 PC 的 IP；连国内是通的，被墙网站不通。

**Comment by AAlieZZ** [comment]
> @AAlieZZ 看起来像是流量没走到pc来，你可以tcpdump -i 接口名，看看有没有来自手机的流量

这个倒是能找到手机的IP
```
18:38:01.940801 IP 10.64.200.4 > archlinux: ICMP echo request, id 1398, seq 1, length 64
18:38:01.940844 IP archlinux > 10.64.200.4: ICMP echo reply, id 1398, seq 1, length 64
18:38:02.447437 IP 10.64.200.4 > archlinux: ICMP echo request, id 1400, seq 1, length 64
18:38:02.447456 IP archlinux > 10.64.200.4: ICMP echo reply, id 1400, seq 1, length 64
18:38:02.958307 IP 10.64.200.4 > archlinux: ICMP echo request, id 1402, seq 1, length 64
18:38:02.958313 IP archlinux > 10.64.200.4: ICMP echo reply, id 1402, seq 1, length 64
18:38:03.321099 58:69:6c:7f:52:78 (oui Unknown) > 01:d0:f8:00:00:02 (oui Unknown), ethertype
```

**Comment by AAlieZZ** [comment]
> @AAlieZZ 你是主动ping的吗，看看浏览网页的时候有没有

这是手机 WiFi 网关设为 PC 后手机访问 test-ipv6.com 得到的输出。

**Comment by mzz2017** [comment]
但是你这里给出的 tcpdump 看起来像是只有 ping

**Comment by AAlieZZ** [comment]
> 但是你这里给出的 tcpdump 看起来像是只有 ping

那确实是很奇怪，访问 test-ipv6.com 只找到这一段有手机的 IP。

**Comment by rhlbest** [comment]
> > 你 Linux 内核是自己编译的么
> 
> 切换到 linux-lts 也不行

请问您怎么解决的？我也遇到了同样的问题
